13:26:54.747096 IP (tos 0x0, ttl 63, id 5997, offset 0, flags [none], proto TCP (6), length 64)
    client-10-228-15-98.tamulink.tamu.edu.33396 > client-10-229-78-103.tamulink.tamu.edu.1234: Flags [S], cksum 0xbaa7 (correct), seq 1203852511, win 64240, options [mss 1460,sackOK,TS val 1110280632 ecr 0,nop,wscale 7,mptcp capable v1], length 0
13:26:54.748671 IP (tos 0x0, ttl 63, id 5998, offset 0, flags [none], proto TCP (6), length 72)
    client-10-228-15-98.tamulink.tamu.edu.33396 > client-10-229-78-103.tamulink.tamu.edu.1234: Flags [.], cksum 0x37ad (correct), ack 3893328437, win 502, options [nop,nop,TS val 1110280634 ecr 1333563684,mptcp capable v1 {0xa1408d99d240bcdc,0xe89d3e04ce33a64}], length 0
13:26:54.750409 IP (tos 0x0, ttl 63, id 5999, offset 0, flags [none], proto TCP (6), length 64)
    client-10-228-15-98.tamulink.tamu.edu.33396 > client-10-229-78-103.tamulink.tamu.edu.1234: Flags [.], cksum 0x8f89 (correct), ack 1025, win 501, options [nop,nop,TS val 1110280636 ecr 1333563686,mptcp dss ack 16146042960874478879], length 0
13:26:54.750409 IP (tos 0x0, ttl 63, id 6000, offset 0, flags [none], proto TCP (6), length 64)
    client-10-228-15-98.tamulink.tamu.edu.33396 > client-10-229-78-103.tamulink.tamu.edu.1234: Flags [.], cksum 0x7f91 (correct), ack 3073, win 493, options [nop,nop,TS val 1110280636 ecr 1333563686,mptcp dss ack 16146042960874480927], length 0
13:26:54.750410 IP (tos 0x0, ttl 63, id 6001, offset 0, flags [none], proto TCP (6), length 64)
    client-10-228-15-98.tamulink.tamu.edu.33396 > client-10-229-78-103.tamulink.tamu.edu.1234: Flags [.], cksum 0x695d (correct), ack 5921, win 481, options [nop,nop,TS val 1110280636 ecr 1333563686,mptcp dss ack 16146042960874483775], length 0
13:26:54.750410 IP (tos 0x0, ttl 63, id 6002, offset 0, flags [none], proto TCP (6), length 64)
    client-10-228-15-98.tamulink.tamu.edu.33396 > client-10-229-78-103.tamulink.tamu.edu.1234: Flags [.], cksum 0x5fa3 (correct), ack 7169, win 475, options [nop,nop,TS val 1110280636 ecr 1333563686,mptcp dss ack 16146042960874485023], length 0
13:26:54.750410 IP (tos 0x0, ttl 63, id 6003, offset 0, flags [none], proto TCP (6), length 64)
    client-10-228-15-98.tamulink.tamu.edu.33396 > client-10-229-78-103.tamulink.tamu.edu.1234: Flags [.], cksum 0x333d (correct), ack 12865, win 449, options [nop,nop,TS val 1110280636 ecr 1333563686,mptcp dss ack 16146042960874490719], length 0
13:26:54.750410 IP (tos 0x0, ttl 63, id 19296, offset 0, flags [none], proto TCP (6), length 72)
    client-10-228-15-98.tamulink.tamu.edu.44388 > client-10-228-98-77.tamulink.tamu.edu.1234: Flags [S], cksum 0xbde3 (correct), seq 1978814627, win 64240, options [mss 1460,sackOK,TS val 670889910 ecr 0,nop,wscale 7,mptcp join id 0 token 0x67ea81d7 nonce 0xacb97aa1], length 0
13:26:54.750410 IP (tos 0x0, ttl 63, id 6004, offset 0, flags [none], proto TCP (6), length 60)
    client-10-228-15-98.tamulink.tamu.edu.33396 > client-10-229-78-103.tamulink.tamu.edu.1234: Flags [.], cksum 0xc02d (correct), ack 12865, win 449, options [nop,nop,TS val 1110280636 ecr 1333563686,mptcp add-addr v1-echo id 1 client-10-228-98-77.tamulink.tamu.edu], length 0
13:26:54.751703 IP (tos 0x0, ttl 63, id 6005, offset 0, flags [none], proto TCP (6), length 64)
    client-10-228-15-98.tamulink.tamu.edu.33396 > client-10-229-78-103.tamulink.tamu.edu.1234: Flags [.], cksum 0x1ccb (correct), ack 15713, win 497, options [nop,nop,TS val 1110280637 ecr 1333563687,mptcp dss ack 16146042960874493567], length 0
13:26:54.751703 IP (tos 0x0, ttl 63, id 6006, offset 0, flags [none], proto TCP (6), length 64)
    client-10-228-15-98.tamulink.tamu.edu.33396 > client-10-229-78-103.tamulink.tamu.edu.1234: Flags [.], cksum 0xe7a8 (correct), ack 22529, win 467, options [nop,nop,TS val 1110280637 ecr 1333563687,mptcp dss ack 16146042960874500383], length 0
13:26:54.751703 IP (tos 0x0, ttl 63, id 6007, offset 0, flags [none], proto TCP (6), length 64)
    client-10-228-15-98.tamulink.tamu.edu.33396 > client-10-229-78-103.tamulink.tamu.edu.1234: Flags [.], cksum 0x78a4 (correct), ack 36769, win 407, options [nop,nop,TS val 1110280637 ecr 1333563687,mptcp dss ack 16146042960874514623], length 0
13:26:54.751912 IP (tos 0x0, ttl 63, id 19297, offset 0, flags [none], proto TCP (6), length 76)
    client-10-228-15-98.tamulink.tamu.edu.44388 > client-10-228-98-77.tamulink.tamu.edu.1234: Flags [.], cksum 0x35c6 (correct), ack 935220559, win 502, options [nop,nop,TS val 670889911 ecr 1350611480,mptcp join hmac 0xba50f57e7302b827003df8192aebbbfe0ff13706], length 0
13:26:54.752658 IP (tos 0x0, ttl 63, id 6008, offset 0, flags [none], proto TCP (6), length 64)
    client-10-228-15-98.tamulink.tamu.edu.33396 > client-10-229-78-103.tamulink.tamu.edu.1234: Flags [.], cksum 0x678a (correct), ack 38913, win 495, options [nop,nop,TS val 1110280638 ecr 1333563688,mptcp dss ack 16146042960874516767], length 0
13:26:54.753519 IP (tos 0x0, ttl 63, id 6009, offset 0, flags [none], proto TCP (6), length 64)
    client-10-228-15-98.tamulink.tamu.edu.33396 > client-10-229-78-103.tamulink.tamu.edu.1234: Flags [.], cksum 0x0eba (correct), ack 50305, win 447, options [nop,nop,TS val 1110280638 ecr 1333563688,mptcp dss ack 16146042960874528159], length 0
13:26:54.753519 IP (tos 0x0, ttl 63, id 19298, offset 0, flags [none], proto TCP (6), length 56)
    client-10-228-15-98.tamulink.tamu.edu.44388 > client-10-228-98-77.tamulink.tamu.edu.1234: Flags [R.], cksum 0x171b (correct), seq 0, ack 1, win 502, options [nop,nop,TS val 670889912 ecr 1350611480,mptcp unknown], length 0
13:26:54.753519 IP (tos 0x0, ttl 63, id 6010, offset 0, flags [none], proto TCP (6), length 64)
    client-10-228-15-98.tamulink.tamu.edu.33396 > client-10-229-78-103.tamulink.tamu.edu.1234: Flags [.], cksum 0xdfd5 (correct), ack 56321, win 417, options [nop,nop,TS val 1110280639 ecr 1333563689,mptcp dss ack 16146042960874534175], length 0
13:26:54.753730 IP (tos 0x0, ttl 63, id 6011, offset 0, flags [none], proto TCP (6), length 64)
    client-10-228-15-98.tamulink.tamu.edu.33396 > client-10-229-78-103.tamulink.tamu.edu.1234: Flags [.], cksum 0x9224 (correct), ack 66289, win 370, options [nop,nop,TS val 1110280639 ecr 1333563689,mptcp dss ack 16146042960874544143], length 0
13:26:54.754680 IP (tos 0x0, ttl 63, id 6012, offset 0, flags [none], proto TCP (6), length 64)
    client-10-228-15-98.tamulink.tamu.edu.33396 > client-10-229-78-103.tamulink.tamu.edu.1234: Flags [.], cksum 0x2e38 (correct), ack 79105, win 316, options [nop,nop,TS val 1110280640 ecr 1333563690,mptcp dss ack 16146042960874556959], length 0
13:26:54.755016 IP (tos 0x0, ttl 63, id 6013, offset 0, flags [none], proto TCP (6), length 64)
    client-10-228-15-98.tamulink.tamu.edu.33396 > client-10-229-78-103.tamulink.tamu.edu.1234: Flags [.], cksum 0xeb9c (correct), ack 87649, win 277, options [nop,nop,TS val 1110280641 ecr 1333563691,mptcp dss ack 16146042960874565503], length 0
13:26:54.755016 IP (tos 0x0, ttl 63, id 6014, offset 0, flags [none], proto TCP (6), length 64)
    client-10-228-15-98.tamulink.tamu.edu.33396 > client-10-229-78-103.tamulink.tamu.edu.1234: Flags [.], cksum 0xa902 (correct), ack 96193, win 239, options [nop,nop,TS val 1110280641 ecr 1333563691,mptcp dss ack 16146042960874574047], length 0
13:26:54.755758 IP (tos 0x0, ttl 63, id 6015, offset 0, flags [none], proto TCP (6), length 64)
    client-10-228-15-98.tamulink.tamu.edu.33396 > client-10-229-78-103.tamulink.tamu.edu.1234: Flags [.], cksum 0x3a01 (correct), ack 110433, win 176, options [nop,nop,TS val 1110280641 ecr 1333563691,mptcp dss ack 16146042960874588287], length 0
13:26:54.756418 IP (tos 0x0, ttl 63, id 6016, offset 0, flags [none], proto TCP (6), length 64)
    client-10-228-15-98.tamulink.tamu.edu.33396 > client-10-229-78-103.tamulink.tamu.edu.1234: Flags [.], cksum 0x20f1 (correct), ack 113649, win 158, options [nop,nop,TS val 1110280642 ecr 1333563692,mptcp dss ack 16146042960874591503], length 0
13:26:54.756418 IP (tos 0x0, ttl 63, id 6017, offset 0, flags [none], proto TCP (6), length 64)
    client-10-228-15-98.tamulink.tamu.edu.33396 > client-10-229-78-103.tamulink.tamu.edu.1234: Flags [.], cksum 0xbd0b (correct), ack 126465, win 99, options [nop,nop,TS val 1110280642 ecr 1333563692,mptcp dss ack 16146042960874604319], length 0
13:26:54.756621 IP (tos 0x0, ttl 63, id 6018, offset 0, flags [none], proto TCP (6), length 64)
    client-10-228-15-98.tamulink.tamu.edu.33396 > client-10-229-78-103.tamulink.tamu.edu.1234: Flags [.], cksum 0x8e29 (correct), ack 132481, win 69, options [nop,nop,TS val 1110280642 ecr 1333563692,mptcp dss ack 16146042960874610335], length 0
13:26:54.757177 IP (tos 0x0, ttl 63, id 6019, offset 0, flags [none], proto TCP (6), length 64)
    client-10-228-15-98.tamulink.tamu.edu.33396 > client-10-229-78-103.tamulink.tamu.edu.1234: Flags [.], cksum 0x5e08 (correct), ack 138657, win 36, options [nop,nop,TS val 1110280643 ecr 1333563693,mptcp dss ack 16146042960874616511], length 0
13:26:54.757531 IP (tos 0x0, ttl 63, id 6020, offset 0, flags [none], proto TCP (6), length 64)
    client-10-228-15-98.tamulink.tamu.edu.33396 > client-10-229-78-103.tamulink.tamu.edu.1234: Flags [.], cksum 0x4f36 (correct), ack 140561, win 22, options [nop,nop,TS val 1110280643 ecr 1333563693,mptcp dss ack 16146042960874618415], length 0
13:26:54.758893 IP (tos 0x0, ttl 63, id 6021, offset 0, flags [none], proto TCP (6), length 64)
    client-10-228-15-98.tamulink.tamu.edu.33396 > client-10-229-78-103.tamulink.tamu.edu.1234: Flags [.], cksum 0x3e45 (correct), ack 142737, win 5, options [nop,nop,TS val 1110280644 ecr 1333563694,mptcp dss ack 16146042960874620591], length 0
13:26:54.759857 IP (tos 0x0, ttl 63, id 6022, offset 0, flags [none], proto TCP (6), length 64)
    client-10-228-15-98.tamulink.tamu.edu.33396 > client-10-229-78-103.tamulink.tamu.edu.1234: Flags [.], cksum 0x3834 (correct), ack 143265, win 501, options [nop,nop,TS val 1110280645 ecr 1333563694,mptcp dss ack 16146042960874621119], length 0
13:26:54.761096 IP (tos 0x0, ttl 63, id 6023, offset 0, flags [none], proto TCP (6), length 64)
    client-10-228-15-98.tamulink.tamu.edu.33396 > client-10-229-78-103.tamulink.tamu.edu.1234: Flags [.], cksum 0xbcd9 (correct), ack 158929, win 746, options [nop,nop,TS val 1110280647 ecr 1333563697,mptcp dss ack 16146042960874636783], length 0
13:26:54.761096 IP (tos 0x0, ttl 63, id 6024, offset 0, flags [none], proto TCP (6), length 64)
    client-10-228-15-98.tamulink.tamu.edu.33396 > client-10-229-78-103.tamulink.tamu.edu.1234: Flags [.], cksum 0x4184 (correct), ack 174593, win 991, options [nop,nop,TS val 1110280647 ecr 1333563697,mptcp dss ack 16146042960874652447], length 0
13:26:54.761479 IP (tos 0x0, ttl 63, id 6025, offset 0, flags [none], proto TCP (6), length 64)
    client-10-228-15-98.tamulink.tamu.edu.33396 > client-10-229-78-103.tamulink.tamu.edu.1234: Flags [.], cksum 0x364e (correct), ack 176017, win 1013, options [nop,nop,TS val 1110280647 ecr 1333563697,mptcp dss ack 16146042960874653871], length 0
13:26:54.763291 IP (tos 0x0, ttl 63, id 6026, offset 0, flags [none], proto TCP (6), length 64)
    client-10-228-15-98.tamulink.tamu.edu.33396 > client-10-229-78-103.tamulink.tamu.edu.1234: Flags [.], cksum 0xafc0 (correct), ack 193105, win 1280, options [nop,nop,TS val 1110280648 ecr 1333563698,mptcp dss ack 16146042960874670959], length 0
13:26:54.763291 IP (tos 0x0, ttl 63, id 6027, offset 0, flags [none], proto TCP (6), length 64)
    client-10-228-15-98.tamulink.tamu.edu.33396 > client-10-229-78-103.tamulink.tamu.edu.1234: Flags [.], cksum 0x4ad6 (correct), ack 205921, win 1481, options [nop,nop,TS val 1110280649 ecr 1333563698,mptcp dss ack 16146042960874683775], length 0
13:26:54.763291 IP (tos 0x0, ttl 63, id 6028, offset 0, flags [none], proto TCP (6), length 64)
    client-10-228-15-98.tamulink.tamu.edu.33396 > client-10-229-78-103.tamulink.tamu.edu.1234: Flags [.], cksum 0x2934 (correct), ack 210193, win 1547, options [nop,nop,TS val 1110280649 ecr 1333563698,mptcp dss ack 16146042960874688047], length 0
13:26:54.764341 IP (tos 0x0, ttl 63, id 6029, offset 0, flags [none], proto TCP (6), length 64)
    client-10-228-15-98.tamulink.tamu.edu.33396 > client-10-229-78-103.tamulink.tamu.edu.1234: Flags [.], cksum 0xa2a5 (correct), ack 227281, win 1814, options [nop,nop,TS val 1110280650 ecr 1333563700,mptcp dss ack 16146042960874705135], length 0
13:26:54.764341 IP (tos 0x0, ttl 63, id 6030, offset 0, flags [none], proto TCP (6), length 64)
    client-10-228-15-98.tamulink.tamu.edu.33396 > client-10-229-78-103.tamulink.tamu.edu.1234: Flags [.], cksum 0x3286 (correct), ack 241521, win 2037, options [nop,nop,TS val 1110280650 ecr 1333563700,mptcp dss ack 16146042960874719375], length 0
13:26:54.764341 IP (tos 0x0, ttl 63, id 6031, offset 0, flags [none], proto TCP (6), length 64)
    client-10-228-15-98.tamulink.tamu.edu.33396 > client-10-229-78-103.tamulink.tamu.edu.1234: Flags [.], cksum 0x10e3 (correct), ack 245793, win 2104, options [nop,nop,TS val 1110280650 ecr 1333563700,mptcp dss ack 16146042960874723647], length 0
13:26:54.767865 IP (tos 0x0, ttl 63, id 6032, offset 0, flags [none], proto TCP (6), length 64)
    client-10-228-15-98.tamulink.tamu.edu.33396 > client-10-229-78-103.tamulink.tamu.edu.1234: Flags [.], cksum 0xd8cf (correct), ack 252913, win 2215, options [nop,nop,TS val 1110280653 ecr 1333563701,mptcp dss ack 16146042960874730767], length 0
13:26:54.767865 IP (tos 0x0, ttl 63, id 6033, offset 0, flags [none], proto TCP (6), length 64)
    client-10-228-15-98.tamulink.tamu.edu.33396 > client-10-229-78-103.tamulink.tamu.edu.1234: Flags [.], cksum 0x470e (correct), ack 271425, win 2504, options [nop,nop,TS val 1110280653 ecr 1333563701,mptcp dss ack 16146042960874749279], length 0
13:26:54.768988 IP (tos 0x0, ttl 63, id 6034, offset 0, flags [none], proto TCP (6), length 64)
    client-10-228-15-98.tamulink.tamu.edu.33396 > client-10-229-78-103.tamulink.tamu.edu.1234: Flags [.], cksum 0x0efe (correct), ack 278545, win 2615, options [nop,nop,TS val 1110280654 ecr 1333563701,mptcp dss ack 16146042960874756399], length 0
13:26:54.768988 IP (tos 0x0, ttl 63, id 6035, offset 0, flags [none], proto TCP (6), length 64)
    client-10-228-15-98.tamulink.tamu.edu.33396 > client-10-229-78-103.tamulink.tamu.edu.1234: Flags [.], cksum 0xe224 (correct), ack 284241, win 2704, options [nop,nop,TS val 1110280654 ecr 1333563701,mptcp dss ack 16146042960874762095], length 0
13:26:54.771333 IP (tos 0x0, ttl 63, id 6036, offset 0, flags [none], proto TCP (6), length 64)
    client-10-228-15-98.tamulink.tamu.edu.33396 > client-10-229-78-103.tamulink.tamu.edu.1234: Flags [.], cksum 0xaa0e (correct), ack 291361, win 2816, options [nop,nop,TS val 1110280656 ecr 1333563705,mptcp dss ack 16146042960874769215], length 0
13:26:54.771333 IP (tos 0x0, ttl 63, id 6037, offset 0, flags [none], proto TCP (6), length 64)
    client-10-228-15-98.tamulink.tamu.edu.33396 > client-10-229-78-103.tamulink.tamu.edu.1234: Flags [.], cksum 0x0d17 (correct), ack 311297, win 3127, options [nop,nop,TS val 1110280656 ecr 1333563705,mptcp dss ack 16146042960874789151], length 0
13:26:54.772217 IP (tos 0x0, ttl 63, id 6038, offset 0, flags [none], proto TCP (6), length 64)
    client-10-228-15-98.tamulink.tamu.edu.33396 > client-10-229-78-103.tamulink.tamu.edu.1234: Flags [.], cksum 0xe03b (correct), ack 316993, win 3216, options [nop,nop,TS val 1110280657 ecr 1333563706,mptcp dss ack 16146042960874794847], length 0
13:26:54.772217 IP (tos 0x0, ttl 63, id 6039, offset 0, flags [none], proto TCP (6), length 64)
    client-10-228-15-98.tamulink.tamu.edu.33396 > client-10-229-78-103.tamulink.tamu.edu.1234: Flags [.], cksum 0x7019 (correct), ack 331233, win 3439, options [nop,nop,TS val 1110280658 ecr 1333563708,mptcp dss ack 16146042960874809087], length 0
13:26:54.772217 IP (tos 0x0, ttl 63, id 6040, offset 0, flags [none], proto TCP (6), length 64)
    client-10-228-15-98.tamulink.tamu.edu.33396 > client-10-229-78-103.tamulink.tamu.edu.1234: Flags [.], cksum 0xde57 (correct), ack 349745, win 3728, options [nop,nop,TS val 1110280658 ecr 1333563708,mptcp dss ack 16146042960874827599], length 0
13:26:54.774330 IP (tos 0x0, ttl 63, id 6041, offset 0, flags [none], proto TCP (6), length 64)
    client-10-228-15-98.tamulink.tamu.edu.33396 > client-10-229-78-103.tamulink.tamu.edu.1234: Flags [.], cksum 0x9b0f (correct), ack 358289, win 3861, options [nop,nop,TS val 1110280660 ecr 1333563709,mptcp dss ack 16146042960874836143], length 0
13:26:54.774331 IP (tos 0x0, ttl 63, id 6042, offset 0, flags [none], proto TCP (6), length 64)
    client-10-228-15-98.tamulink.tamu.edu.33396 > client-10-229-78-103.tamulink.tamu.edu.1234: Flags [.], cksum 0x294d (correct), ack 372737, win 4087, options [nop,nop,TS val 1110280660 ecr 1333563709,mptcp dss ack 16146042960874850591], length 0
13:26:54.774331 IP (tos 0x0, ttl 63, id 6043, offset 0, flags [none], proto TCP (6), length 64)
    client-10-228-15-98.tamulink.tamu.edu.33396 > client-10-229-78-103.tamulink.tamu.edu.1234: Flags [.], cksum 0xa84c (correct), ack 389121, win 4343, options [nop,nop,TS val 1110280660 ecr 1333563709,mptcp dss ack 16146042960874866975], length 0
13:26:54.774331 IP (tos 0x0, ttl 63, id 6044, offset 0, flags [none], proto TCP (6), length 64)
    client-10-228-15-98.tamulink.tamu.edu.33396 > client-10-229-78-103.tamulink.tamu.edu.1234: Flags [.], cksum 0x9d15 (correct), ack 390545, win 4366, options [nop,nop,TS val 1110280660 ecr 1333563709,mptcp dss ack 16146042960874868399], length 0
13:26:54.775630 IP (tos 0x0, ttl 63, id 6045, offset 0, flags [none], proto TCP (6), length 64)
    client-10-228-15-98.tamulink.tamu.edu.33396 > client-10-229-78-103.tamulink.tamu.edu.1234: Flags [.], cksum 0x4e97 (correct), ack 400513, win 4521, options [nop,nop,TS val 1110280661 ecr 1333563711,mptcp dss ack 16146042960874878367], length 0
13:26:54.776670 IP (tos 0x0, ttl 63, id 6046, offset 0, flags [none], proto TCP (6), length 64)
    client-10-228-15-98.tamulink.tamu.edu.33396 > client-10-229-78-103.tamulink.tamu.edu.1234: Flags [.], cksum 0x1f38 (correct), ack 406529, win 4615, options [nop,nop,TS val 1110280662 ecr 1333563711,mptcp dss ack 16146042960874884383], length 0
13:26:54.776670 IP (tos 0x0, ttl 63, id 6047, offset 0, flags [none], proto TCP (6), length 64)
    client-10-228-15-98.tamulink.tamu.edu.33396 > client-10-229-78-103.tamulink.tamu.edu.1234: Flags [.], cksum 0x9e37 (correct), ack 422913, win 4871, options [nop,nop,TS val 1110280662 ecr 1333563711,mptcp dss ack 16146042960874900767], length 0
13:26:54.776670 IP (tos 0x0, ttl 63, id 6048, offset 0, flags [none], proto TCP (6), length 64)
    client-10-228-15-98.tamulink.tamu.edu.33396 > client-10-229-78-103.tamulink.tamu.edu.1234: Flags [.], cksum 0x4484 (correct), ack 434305, win 5049, options [nop,nop,TS val 1110280662 ecr 1333563712,mptcp dss ack 16146042960874912159], length 0
13:26:54.777131 IP (tos 0x0, ttl 63, id 6049, offset 0, flags [none], proto TCP (6), length 64)
    client-10-228-15-98.tamulink.tamu.edu.33396 > client-10-229-78-103.tamulink.tamu.edu.1234: Flags [.], cksum 0x1525 (correct), ack 440321, win 5143, options [nop,nop,TS val 1110280662 ecr 1333563713,mptcp dss ack 16146042960874918175], length 0
13:26:54.777752 IP (tos 0x0, ttl 63, id 6050, offset 0, flags [none], proto TCP (6), length 64)
    client-10-228-15-98.tamulink.tamu.edu.33396 > client-10-229-78-103.tamulink.tamu.edu.1234: Flags [.], cksum 0x9423 (correct), ack 456705, win 5399, options [nop,nop,TS val 1110280663 ecr 1333563713,mptcp dss ack 16146042960874934559], length 0
13:26:54.778657 IP (tos 0x0, ttl 63, id 6051, offset 0, flags [none], proto TCP (6), length 64)
    client-10-228-15-98.tamulink.tamu.edu.33396 > client-10-229-78-103.tamulink.tamu.edu.1234: Flags [.], cksum 0xe0bc (correct), ack 479489, win 5755, options [nop,nop,TS val 1110280664 ecr 1333563714,mptcp dss ack 16146042960874957343], length 0
13:26:54.779517 IP (tos 0x0, ttl 63, id 6052, offset 0, flags [none], proto TCP (6), length 64)
    client-10-228-15-98.tamulink.tamu.edu.33396 > client-10-229-78-103.tamulink.tamu.edu.1234: Flags [.], cksum 0x9d75 (correct), ack 488033, win 5889, options [nop,nop,TS val 1110280665 ecr 1333563714,mptcp dss ack 16146042960874965887], length 0
13:26:54.779517 IP (tos 0x0, ttl 63, id 6053, offset 0, flags [none], proto TCP (6), length 64)
    client-10-228-15-98.tamulink.tamu.edu.33396 > client-10-229-78-103.tamulink.tamu.edu.1234: Flags [.], cksum 0x417f (correct), ack 499713, win 6071, options [nop,nop,TS val 1110280665 ecr 1333563714,mptcp dss ack 16146042960874977567], length 0
13:26:54.780139 IP (tos 0x0, ttl 63, id 6054, offset 0, flags [none], proto TCP (6), length 64)
    client-10-228-15-98.tamulink.tamu.edu.33396 > client-10-229-78-103.tamulink.tamu.edu.1234: Flags [.], cksum 0x1fdb (correct), ack 503985, win 6138, options [nop,nop,TS val 1110280665 ecr 1333563715,mptcp dss ack 16146042960874981839], length 0
13:26:54.780139 IP (tos 0x0, ttl 63, id 6055, offset 0, flags [none], proto TCP (6), length 64)
    client-10-228-15-98.tamulink.tamu.edu.33396 > client-10-229-78-103.tamulink.tamu.edu.1234: Flags [.], cksum 0xc07d (correct), ack 516097, win 6327, options [nop,nop,TS val 1110280665 ecr 1333563715,mptcp dss ack 16146042960874993951], length 0
13:26:54.780984 IP (tos 0x0, ttl 63, id 6056, offset 0, flags [none], proto TCP (6), length 64)
    client-10-228-15-98.tamulink.tamu.edu.33396 > client-10-229-78-103.tamulink.tamu.edu.1234: Flags [.], cksum 0x376a (correct), ack 533505, win 6599, options [nop,nop,TS val 1110280667 ecr 1333563716,mptcp dss ack 16146042960875011359], length 0
13:26:54.780984 IP (tos 0x0, ttl 63, id 6057, offset 0, flags [none], proto TCP (6), length 64)
    client-10-228-15-98.tamulink.tamu.edu.33396 > client-10-229-78-103.tamulink.tamu.edu.1234: Flags [.], cksum 0xb668 (correct), ack 549889, win 6855, options [nop,nop,TS val 1110280667 ecr 1333563717,mptcp dss ack 16146042960875027743], length 0
13:26:54.780984 IP (tos 0x0, ttl 63, id 6058, offset 0, flags [none], proto TCP (6), length 64)
    client-10-228-15-98.tamulink.tamu.edu.33396 > client-10-229-78-103.tamulink.tamu.edu.1234: Flags [.], cksum 0x4649 (correct), ack 564129, win 7078, options [nop,nop,TS val 1110280667 ecr 1333563717,mptcp dss ack 16146042960875041983], length 0
13:26:54.780984 IP (tos 0x0, ttl 63, id 6059, offset 0, flags [none], proto TCP (6), length 64)
    client-10-228-15-98.tamulink.tamu.edu.33396 > client-10-229-78-103.tamulink.tamu.edu.1234: Flags [.], cksum 0x3b12 (correct), ack 565553, win 7101, options [nop,nop,TS val 1110280667 ecr 1333563717,mptcp dss ack 16146042960875043407], length 0
13:26:54.781861 IP (tos 0x0, ttl 63, id 6060, offset 0, flags [none], proto TCP (6), length 64)
    client-10-228-15-98.tamulink.tamu.edu.33396 > client-10-229-78-103.tamulink.tamu.edu.1234: Flags [.], cksum 0x2d56 (correct), ack 567297, win 7128, options [nop,nop,TS val 1110280667 ecr 1333563718,mptcp dss ack 16146042960875045151], length 0
13:26:54.781861 IP (tos 0x0, ttl 63, id 6061, offset 0, flags [none], proto TCP (6), length 64)
    client-10-228-15-98.tamulink.tamu.edu.33396 > client-10-229-78-103.tamulink.tamu.edu.1234: Flags [.], cksum 0xac55 (correct), ack 583681, win 7384, options [nop,nop,TS val 1110280667 ecr 1333563718,mptcp dss ack 16146042960875061535], length 0
13:26:54.782427 IP (tos 0x0, ttl 63, id 6062, offset 0, flags [none], proto TCP (6), length 64)
    client-10-228-15-98.tamulink.tamu.edu.33396 > client-10-229-78-103.tamulink.tamu.edu.1234: Flags [.], cksum 0x1a93 (correct), ack 602193, win 7673, options [nop,nop,TS val 1110280668 ecr 1333563718,mptcp dss ack 16146042960875080047], length 0
13:26:54.782792 IP (tos 0x0, ttl 63, id 6063, offset 0, flags [none], proto TCP (6), length 64)
    client-10-228-15-98.tamulink.tamu.edu.33396 > client-10-229-78-103.tamulink.tamu.edu.1234: Flags [.], cksum 0x9f3d (correct), ack 617857, win 7918, options [nop,nop,TS val 1110280668 ecr 1333563718,mptcp dss ack 16146042960875095711], length 0
13:26:54.782792 IP (tos 0x0, ttl 63, id 6064, offset 0, flags [none], proto TCP (6), length 64)
    client-10-228-15-98.tamulink.tamu.edu.33396 > client-10-229-78-103.tamulink.tamu.edu.1234: Flags [.], cksum 0x59b2 (correct), ack 626689, win 8056, options [nop,nop,TS val 1110280668 ecr 1333563719,mptcp dss ack 16146042960875104543], length 0
13:26:54.782792 IP (tos 0x0, ttl 63, id 6065, offset 0, flags [none], proto TCP (6), length 64)
    client-10-228-15-98.tamulink.tamu.edu.33396 > client-10-229-78-103.tamulink.tamu.edu.1234: Flags [.], cksum 0xffff (correct), ack 638081, win 8234, options [nop,nop,TS val 1110280668 ecr 1333563719,mptcp dss ack 16146042960875115935], length 0
13:26:54.783231 IP (tos 0x0, ttl 63, id 6066, offset 0, flags [none], proto TCP (6), length 64)
    client-10-228-15-98.tamulink.tamu.edu.33396 > client-10-229-78-103.tamulink.tamu.edu.1234: Flags [.], cksum 0xd8b0 (correct), ack 643073, win 8312, options [nop,nop,TS val 1110280669 ecr 1333563719,mptcp dss ack 16146042960875120927], length 0
13:26:54.783950 IP (tos 0x0, ttl 63, id 6067, offset 0, flags [none], proto TCP (6), length 64)
    client-10-228-15-98.tamulink.tamu.edu.33396 > client-10-229-78-103.tamulink.tamu.edu.1234: Flags [.], cksum 0x4fa0 (correct), ack 660481, win 8584, options [nop,nop,TS val 1110280669 ecr 1333563719,mptcp dss ack 16146042960875138335], length 0
13:26:54.784211 IP (tos 0x0, ttl 63, id 6068, offset 0, flags [none], proto TCP (6), length 64)
    client-10-228-15-98.tamulink.tamu.edu.33396 > client-10-229-78-103.tamulink.tamu.edu.1234: Flags [.], cksum 0xce9d (correct), ack 676865, win 8840, options [nop,nop,TS val 1110280670 ecr 1333563720,mptcp dss ack 16146042960875154719], length 0
13:26:54.784211 IP (tos 0x0, ttl 63, id 6069, offset 0, flags [none], proto TCP (6), length 64)
    client-10-228-15-98.tamulink.tamu.edu.33396 > client-10-229-78-103.tamulink.tamu.edu.1234: Flags [.], cksum 0x4812 (correct), ack 693953, win 9107, options [nop,nop,TS val 1110280670 ecr 1333563720,mptcp dss ack 16146042960875171807], length 0
13:26:54.784211 IP (tos 0x0, ttl 63, id 6070, offset 0, flags [none], proto TCP (6), length 64)
    client-10-228-15-98.tamulink.tamu.edu.33396 > client-10-229-78-103.tamulink.tamu.edu.1234: Flags [.], cksum 0x23ef (correct), ack 698545, win 9174, options [nop,nop,TS val 1110280670 ecr 1333563720,mptcp dss ack 16146042960875176399], length 0
13:26:54.784892 IP (tos 0x0, ttl 63, id 6071, offset 0, flags [none], proto TCP (6), length 64)
    client-10-228-15-98.tamulink.tamu.edu.33396 > client-10-229-78-103.tamulink.tamu.edu.1234: Flags [.], cksum 0x86f6 (correct), ack 718481, win 9485, options [nop,nop,TS val 1110280670 ecr 1333563721,mptcp dss ack 16146042960875196335], length 0
13:26:54.785258 IP (tos 0x0, ttl 63, id 6072, offset 0, flags [none], proto TCP (6), length 64)
    client-10-228-15-98.tamulink.tamu.edu.33396 > client-10-229-78-103.tamulink.tamu.edu.1234: Flags [.], cksum 0xe8aa (correct), ack 738585, win 9799, options [nop,nop,TS val 1110280671 ecr 1333563721,mptcp dss ack 16146042960875216439], length 0
13:26:54.785259 IP (tos 0x0, ttl 63, id 6073, offset 0, flags [none], proto TCP (6), length 64)
    client-10-228-15-98.tamulink.tamu.edu.33396 > client-10-229-78-103.tamulink.tamu.edu.1234: Flags [.], cksum 0x61ce (correct), ack 755713, win 10067, options [nop,nop,TS val 1110280671 ecr 1333563721,mptcp dss ack 16146042960875233567], length 0
13:26:54.785259 IP (tos 0x0, ttl 63, id 6074, offset 0, flags [none], proto TCP (6), length 64)
    client-10-228-15-98.tamulink.tamu.edu.33396 > client-10-229-78-103.tamulink.tamu.edu.1234: Flags [.], cksum 0x5698 (correct), ack 757137, win 10089, options [nop,nop,TS val 1110280671 ecr 1333563721,mptcp dss ack 16146042960875234991], length 0
13:26:54.785990 IP (tos 0x0, ttl 63, id 6075, offset 0, flags [none], proto TCP (6), length 64)
    client-10-228-15-98.tamulink.tamu.edu.33396 > client-10-229-78-103.tamulink.tamu.edu.1234: Flags [.], cksum 0xd8bb (correct), ack 773121, win 10339, options [nop,nop,TS val 1110280672 ecr 1333563722,mptcp dss ack 16146042960875250975], length 0
13:26:54.785991 IP (tos 0x0, ttl 63, id 6076, offset 0, flags [none], proto TCP (6), length 64)
    client-10-228-15-98.tamulink.tamu.edu.33396 > client-10-229-78-103.tamulink.tamu.edu.1234: Flags [.], cksum 0x4fab (correct), ack 790529, win 10611, options [nop,nop,TS val 1110280672 ecr 1333563722,mptcp dss ack 16146042960875268383], length 0
13:26:54.786605 IP (tos 0x0, ttl 63, id 6077, offset 0, flags [none], proto TCP (6), length 64)
    client-10-228-15-98.tamulink.tamu.edu.33396 > client-10-229-78-103.tamulink.tamu.edu.1234: Flags [.], cksum 0xceaa (correct), ack 806913, win 10867, options [nop,nop,TS val 1110280672 ecr 1333563722,mptcp dss ack 16146042960875284767], length 0
13:26:54.787042 IP (tos 0x0, ttl 63, id 6078, offset 0, flags [none], proto TCP (6), length 64)
    client-10-228-15-98.tamulink.tamu.edu.33396 > client-10-229-78-103.tamulink.tamu.edu.1234: Flags [.], cksum 0x4599 (correct), ack 824321, win 11139, options [nop,nop,TS val 1110280672 ecr 1333563723,mptcp dss ack 16146042960875302175], length 0
13:26:54.787042 IP (tos 0x0, ttl 63, id 6079, offset 0, flags [none], proto TCP (6), length 64)
    client-10-228-15-98.tamulink.tamu.edu.33396 > client-10-229-78-103.tamulink.tamu.edu.1234: Flags [.], cksum 0xd578 (correct), ack 838561, win 11362, options [nop,nop,TS val 1110280673 ecr 1333563723,mptcp dss ack 16146042960875316415], length 0
13:26:54.787042 IP (tos 0x0, ttl 63, id 6080, offset 0, flags [none], proto TCP (6), length 64)
    client-10-228-15-98.tamulink.tamu.edu.33396 > client-10-229-78-103.tamulink.tamu.edu.1234: Flags [.], cksum 0xc497 (correct), ack 840705, win 11395, options [nop,nop,TS val 1110280673 ecr 1333563723,mptcp dss ack 16146042960875318559], length 0
13:26:54.788720 IP (tos 0x0, ttl 63, id 6081, offset 0, flags [none], proto TCP (6), length 64)
    client-10-228-15-98.tamulink.tamu.edu.33396 > client-10-229-78-103.tamulink.tamu.edu.1234: Flags [.], cksum 0x3b87 (correct), ack 858113, win 11667, options [nop,nop,TS val 1110280673 ecr 1333563723,mptcp dss ack 16146042960875335967], length 0
13:26:54.788720 IP (tos 0x0, ttl 63, id 6082, offset 0, flags [none], proto TCP (6), length 64)
    client-10-228-15-98.tamulink.tamu.edu.33396 > client-10-229-78-103.tamulink.tamu.edu.1234: Flags [.], cksum 0x5012 (correct), ack 888017, win 12134, options [nop,nop,TS val 1110280673 ecr 1333563724,mptcp dss ack 16146042960875365871], length 0
13:26:54.789253 IP (tos 0x0, ttl 63, id 6083, offset 0, flags [none], proto TCP (6), length 64)
    client-10-228-15-98.tamulink.tamu.edu.33396 > client-10-229-78-103.tamulink.tamu.edu.1234: Flags [.], cksum 0x39a3 (correct), ack 890865, win 12179, options [nop,nop,TS val 1110280675 ecr 1333563724,mptcp dss ack 16146042960875368719], length 0
13:26:54.789253 IP (tos 0x0, ttl 63, id 6084, offset 0, flags [none], proto TCP (6), length 64)
    client-10-228-15-98.tamulink.tamu.edu.33396 > client-10-229-78-103.tamulink.tamu.edu.1234: Flags [.], cksum 0xc984 (correct), ack 905105, win 12401, options [nop,nop,TS val 1110280675 ecr 1333563724,mptcp dss ack 16146042960875382959], length 0
13:26:54.789253 IP (tos 0x0, ttl 63, id 6085, offset 0, flags [none], proto TCP (6), length 64)
    client-10-228-15-98.tamulink.tamu.edu.33396 > client-10-229-78-103.tamulink.tamu.edu.1234: Flags [.], cksum 0xc8a4 (correct), ack 905217, win 12401, options [nop,nop,TS val 1110280675 ecr 1333563724,mptcp dss ack 16146042960875383071], length 0
13:26:54.789253 IP (tos 0x0, ttl 63, id 6086, offset 0, flags [none], proto TCP (6), length 64)
    client-10-228-15-98.tamulink.tamu.edu.33396 > client-10-229-78-103.tamulink.tamu.edu.1234: Flags [.], cksum 0x3f93 (correct), ack 922625, win 12673, options [nop,nop,TS val 1110280675 ecr 1333563725,mptcp dss ack 16146042960875400479], length 0
13:26:54.789253 IP (tos 0x0, ttl 63, id 6087, offset 0, flags [none], proto TCP (6), length 64)
    client-10-228-15-98.tamulink.tamu.edu.33396 > client-10-229-78-103.tamulink.tamu.edu.1234: Flags [.], cksum 0x2926 (correct), ack 925473, win 12718, options [nop,nop,TS val 1110280675 ecr 1333563725,mptcp dss ack 16146042960875403327], length 0
13:26:54.789483 IP (tos 0x0, ttl 63, id 6088, offset 0, flags [none], proto TCP (6), length 64)
    client-10-228-15-98.tamulink.tamu.edu.33396 > client-10-229-78-103.tamulink.tamu.edu.1234: Flags [.], cksum 0xb682 (correct), ack 940033, win 12945, options [nop,nop,TS val 1110280675 ecr 1333563725,mptcp dss ack 16146042960875417887], length 0
13:26:54.790036 IP (tos 0x0, ttl 63, id 6089, offset 0, flags [none], proto TCP (6), length 64)
    client-10-228-15-98.tamulink.tamu.edu.33396 > client-10-229-78-103.tamulink.tamu.edu.1234: Flags [.], cksum 0x5198 (correct), ack 952849, win 13146, options [nop,nop,TS val 1110280675 ecr 1333563726,mptcp dss ack 16146042960875430703], length 0
13:26:54.790036 IP (tos 0x0, ttl 63, id 6090, offset 0, flags [none], proto TCP (6), length 64)
    client-10-228-15-98.tamulink.tamu.edu.33396 > client-10-229-78-103.tamulink.tamu.edu.1234: Flags [.], cksum 0x2d70 (correct), ack 957441, win 13217, options [nop,nop,TS val 1110280676 ecr 1333563726,mptcp dss ack 16146042960875435295], length 0
13:26:54.790036 IP (tos 0x0, ttl 63, id 6091, offset 0, flags [none], proto TCP (6), length 64)
    client-10-228-15-98.tamulink.tamu.edu.33396 > client-10-229-78-103.tamulink.tamu.edu.1234: Flags [.], cksum 0xac6f (correct), ack 973825, win 13473, options [nop,nop,TS val 1110280676 ecr 1333563726,mptcp dss ack 16146042960875451679], length 0
13:26:54.790485 IP (tos 0x0, ttl 63, id 6092, offset 0, flags [none], proto TCP (6), length 64)
    client-10-228-15-98.tamulink.tamu.edu.33396 > client-10-229-78-103.tamulink.tamu.edu.1234: Flags [.], cksum 0x235f (correct), ack 991233, win 13745, options [nop,nop,TS val 1110280676 ecr 1333563726,mptcp dss ack 16146042960875469087], length 0
13:26:54.790485 IP (tos 0x0, ttl 63, id 6093, offset 0, flags [none], proto TCP (6), length 64)
    client-10-228-15-98.tamulink.tamu.edu.33396 > client-10-229-78-103.tamulink.tamu.edu.1234: Flags [.], cksum 0xeb4e (correct), ack 998353, win 13857, options [nop,nop,TS val 1110280676 ecr 1333563726,mptcp dss ack 16146042960875476207], length 0
13:26:54.790485 IP (tos 0x0, ttl 63, id 6094, offset 0, flags [none], proto TCP (6), length 64)
    client-10-228-15-98.tamulink.tamu.edu.33396 > client-10-229-78-103.tamulink.tamu.edu.1234: Flags [.], cksum 0xa25e (correct), ack 1007617, win 14001, options [nop,nop,TS val 1110280676 ecr 1333563726,mptcp dss ack 16146042960875485471], length 0
13:26:54.791099 IP (tos 0x0, ttl 63, id 6095, offset 0, flags [none], proto TCP (6), length 64)
    client-10-228-15-98.tamulink.tamu.edu.33396 > client-10-229-78-103.tamulink.tamu.edu.1234: Flags [.], cksum 0x8bef (correct), ack 1010465, win 14046, options [nop,nop,TS val 1110280677 ecr 1333563727,mptcp dss ack 16146042960875488319], length 0
13:26:54.791100 IP (tos 0x0, ttl 63, id 6096, offset 0, flags [none], proto TCP (6), length 64)
    client-10-228-15-98.tamulink.tamu.edu.33396 > client-10-229-78-103.tamulink.tamu.edu.1234: Flags [.], cksum 0x215c (correct), ack 1024001, win 14257, options [nop,nop,TS val 1110280677 ecr 1333563727,mptcp dss ack 16146042960875501855], length 0
13:26:54.791100 IP (tos 0x0, ttl 63, id 6097, offset 0, flags [none], proto TCP (6), length 64)
    client-10-228-15-98.tamulink.tamu.edu.33396 > client-10-229-78-103.tamulink.tamu.edu.1234: Flags [.], cksum 0x6df7 (correct), ack 1046785, win 14613, options [nop,nop,TS val 1110280677 ecr 1333563727,mptcp dss ack 16146042960875524639], length 0
13:26:54.791100 IP (tos 0x0, ttl 63, id 6098, offset 0, flags [none], proto TCP (6), length 64)
    client-10-228-15-98.tamulink.tamu.edu.33396 > client-10-229-78-103.tamulink.tamu.edu.1234: Flags [.], cksum 0x2ac1 (correct), ack 1055321, win 14747, options [nop,nop,TS val 1110280677 ecr 1333563727,mptcp dss ack 16146042960875533175], length 0
13:26:54.791100 IP (tos 0x0, ttl 63, id 6099, offset 0, flags [none], proto TCP (6), length 64)
    client-10-228-15-98.tamulink.tamu.edu.33396 > client-10-229-78-103.tamulink.tamu.edu.1234: Flags [.], cksum 0xd10e (correct), ack 1066713, win 14925, options [nop,nop,TS val 1110280677 ecr 1333563727,mptcp dss ack 16146042960875544567], length 0
13:26:54.791100 IP (tos 0x0, ttl 63, id 6100, offset 0, flags [none], proto TCP (6), length 64)
    client-10-228-15-98.tamulink.tamu.edu.33396 > client-10-229-78-103.tamulink.tamu.edu.1234: Flags [.], cksum 0xa6c0 (correct), ack 1072129, win 14923, options [nop,nop,TS val 1110280677 ecr 1333563727,mptcp dss ack 16146042960875549983], length 0
13:26:54.793347 IP (tos 0x0, ttl 63, id 6101, offset 0, flags [none], proto TCP (6), length 64)
    client-10-228-15-98.tamulink.tamu.edu.33396 > client-10-229-78-103.tamulink.tamu.edu.1234: Flags [.], cksum 0x2699 (correct), ack 1088513, win 14960, options [nop,nop,TS val 1110280678 ecr 1333563728,mptcp dss ack 16146042960875566367], length 0
13:26:54.793347 IP (tos 0x0, ttl 63, id 6102, offset 0, flags [none], proto TCP (6), length 64)
    client-10-228-15-98.tamulink.tamu.edu.33396 > client-10-229-78-103.tamulink.tamu.edu.1234: Flags [.], cksum 0x9eeb (correct), ack 1105921, win 14877, options [nop,nop,TS val 1110280678 ecr 1333563728,mptcp dss ack 16146042960875583775], length 0
13:26:54.793348 IP (tos 0x0, ttl 63, id 6103, offset 0, flags [none], proto TCP (6), length 64)
    client-10-228-15-98.tamulink.tamu.edu.33396 > client-10-229-78-103.tamulink.tamu.edu.1234: Flags [.], cksum 0x1f36 (correct), ack 1122305, win 14802, options [nop,nop,TS val 1110280678 ecr 1333563728,mptcp dss ack 16146042960875600159], length 0
13:26:54.793348 IP (tos 0x0, ttl 63, id 6104, offset 0, flags [none], proto TCP (6), length 64)
    client-10-228-15-98.tamulink.tamu.edu.33396 > client-10-229-78-103.tamulink.tamu.edu.1234: Flags [.], cksum 0x9788 (correct), ack 1139713, win 14719, options [nop,nop,TS val 1110280678 ecr 1333563728,mptcp dss ack 16146042960875617567], length 0
13:26:54.793348 IP (tos 0x0, ttl 63, id 6105, offset 0, flags [none], proto TCP (6), length 64)
    client-10-228-15-98.tamulink.tamu.edu.33396 > client-10-229-78-103.tamulink.tamu.edu.1234: Flags [.], cksum 0x49d5 (correct), ack 1149681, win 14674, options [nop,nop,TS val 1110280678 ecr 1333563728,mptcp dss ack 16146042960875627535], length 0
13:26:54.794034 IP (tos 0x0, ttl 63, id 6106, offset 0, flags [none], proto TCP (6), length 64)
    client-10-228-15-98.tamulink.tamu.edu.33396 > client-10-229-78-103.tamulink.tamu.edu.1234: Flags [.], cksum 0x1667 (correct), ack 1156097, win 15004, options [nop,nop,TS val 1110280680 ecr 1333563730,mptcp dss ack 16146042960875633951], length 0
13:26:54.794034 IP (tos 0x0, ttl 63, id 6107, offset 0, flags [none], proto TCP (6), length 64)
    client-10-228-15-98.tamulink.tamu.edu.33396 > client-10-229-78-103.tamulink.tamu.edu.1234: Flags [.], cksum 0x8eb9 (correct), ack 1173505, win 14921, options [nop,nop,TS val 1110280680 ecr 1333563730,mptcp dss ack 16146042960875651359], length 0
13:26:54.794034 IP (tos 0x0, ttl 63, id 6108, offset 0, flags [none], proto TCP (6), length 64)
    client-10-228-15-98.tamulink.tamu.edu.33396 > client-10-229-78-103.tamulink.tamu.edu.1234: Flags [.], cksum 0x0f06 (correct), ack 1189889, win 14844, options [nop,nop,TS val 1110280680 ecr 1333563730,mptcp dss ack 16146042960875667743], length 0
13:26:54.794034 IP (tos 0x0, ttl 63, id 6109, offset 0, flags [none], proto TCP (6), length 64)
    client-10-228-15-98.tamulink.tamu.edu.33396 > client-10-229-78-103.tamulink.tamu.edu.1234: Flags [.], cksum 0xf8d1 (correct), ack 1192737, win 14832, options [nop,nop,TS val 1110280680 ecr 1333563730,mptcp dss ack 16146042960875670591], length 0
